### ISSUE TITLE
net/http: Websocket connections through reverse proxy are not closing properly resulting in a connection left in FIN_WAIT2 forever

### ISSUE THREAD

**Issue by ameowlia** [golang/go#75807]
### Go version
go version go1.25.2 linux/arm64

I did a binary search of go and determined that it was [this commit ](https://github.com/golang/go/commit/a053e79024) from [this issue](https://github.com/golang/go/issues/35892) that caused this change.

### Output of `go env` in your module/workspace:
<details>

```shell
AR='ar'
CC='gcc'
CGO_CFLAGS='-O2 -g'
CGO_CPPFLAGS=''
CGO_CXXFLAGS='-O2 -g'
CGO_ENABLED='1'
CGO_FFLAGS='-O2 -g'
CGO_LDFLAGS='-O2 -g'
CXX='g++'
GCCGO='gccgo'
GO111MODULE=''
GOARCH='arm64'
GOARM64='v8.0'
GOAUTH='netrc'
GOBIN=''
GOCACHE='/home/pivotal/.cache/go-build'
GOCACHEPROG=''
GODEBUG=''
GOENV='/home/pivotal/.config/go/env'
GOEXE=''
GOEXPERIMENT=''
GOFIPS140='off'
GOFLAGS=''
GOGCCFLAGS='-fPIC -pthread -Wl,--no-gc-sections -fmessage-length=0 -ffile-prefix-map=/tmp/go-build2837296816=/tmp/go-build -gno-record-gcc-switches'
GOHOSTARCH='arm64'
GOHOSTOS='linux'
GOINSECURE=''
GOMODCACHE='/home/pivotal/go/pkg/mod'
GONOPROXY='github.gwd.broadcom.net/'
GONOSUMDB='github.gwd.broadcom.net/'
GOOS='linux'
GOPATH='/home/pivotal/go'
GOPRIVATE='github.gwd.broadcom.net/'
GOPROXY='https://proxy.golang.org,direct'
GOROOT='/home/pivotal/workspace/go'
GOSUMDB='sum.golang.org'
GOTELEMETRY='local'
GOTELEMETRYDIR='/home/pivotal/.config/go/telemetry'
GOTMPDIR=''
GOTOOLCHAIN='auto'
GOTOOLDIR='/home/pivotal/workspace/go/pkg/tool/linux_arm64'
GOVCS=''
GOVERSION='go1.25.2'
GOWORK=''
PKG_CONFIG='pkg-config'
```
</details>

### What did you do?

1. I ran an app that accepts websocket upgrades.
2. I ran a reverse proxy that sends traffic to that app.
3. I ran a client that sends websocket requests to the reverse proxy.
4. I ctrl-C the client.

I was only able to duplicate this issue when running the app and reverse proxy separately. I will continue working on trying to minimize the reproduction steps into one file.

App + Client reproduction code is copied with minimal edits from [gorilla/websocket examples](https://github.com/gorilla/websocket/tree/main/examples/echo).

**App Code**
<details>

```go
package main

import (
        "flag"
        "fmt"
        "net/http"
        "strings"

        "github.com/gorilla/websocket"
        "golang.org/x/net/http/httpguts"
)

var upgrader = websocket.Upgrader{
        ReadBufferSize:  1024,
        WriteBufferSize: 1024,
}

func upgradeType(h http.Header) string {
        if !httpguts.HeaderValuesContainsToken(h["Connection"], "Upgrade") {
                return ""
        }
        return strings.ToLower(h.Get("Upgrade"))
}

var appPort = flag.String("appPort", "8888", "port")

func main() {
        flag.Parse()
        http.HandleFunc("/echo", func(w http.ResponseWriter, r *http.Request) {
                if upgradeType(r.Header) != "websocket" {
                        http.Error(w, "unexpected request", 400)
                        return
                }
                conn, err := upgrader.Upgrade(w, r, nil)
                if err != nil {
                        panic(err)
                }

                for {
                        // Read message
                        msgType, msg, err := conn.ReadMessage()
                        if err != nil {
                                return
                        }

                        // Print the message to the console
                        fmt.Printf("%s sent: %s\n", conn.RemoteAddr(), string(msg))

                        // Write same message back
                        if err = conn.WriteMessage(msgType, msg); err != nil {
                                return
                        }
                }
        })

        portWithColon := fmt.Sprintf(":%s", *appPort)
        fmt.Printf("app listening on %s", portWithColon)
        http.ListenAndServe(portWithColon, nil)
}
```

</details>

**Reverse Proxy Code**
<details>

```go
package main

import (
        "flag"
        "fmt"
        "net/http"
        "net/http/httputil"
        "net/url"
)

var port = flag.String("reverseProxyPort", "9999", "port for reverse proxy")
var appPort = flag.String("appPort", "8888", "port for app to proxy to")

func main() {
        flag.Parse()
        remote, err := url.Parse(fmt.Sprintf("http://localhost:%s", *appPort))
        if err != nil {
                panic(err)
        }

        handler := func(p *httputil.ReverseProxy) func(http.ResponseWriter, *http.Request) {
                return func(w http.ResponseWriter, r *http.Request) {
                        p.ServeHTTP(w, r)
                }
        }

        proxy := httputil.NewSingleHostReverseProxy(remote)
        http.HandleFunc("/", handler(proxy))

        portWithColon := fmt.Sprintf(":%s", *port)
        fmt.Printf("reverse proxy listening on %s", portWithColon)
        err = http.ListenAndServe(portWithColon, nil)
        if err != nil {
                panic(err)
        }
}
```

</details>

**Client Code**
<details>

```go
package main

import (
        "flag"
        "log"
        "net/url"
        "os"
        "os/signal"
        "time"

        "github.com/gorilla/websocket"
)

var addr = flag.String("addr", "localhost:9999", "http service address")
var path = flag.String("path", "/echo", "path")

func main() {
        flag.Parse()
        log.SetFlags(0)

        interrupt := make(chan os.Signal, 1)
        signal.Notify(interrupt, os.Interrupt)

        u := url.URL{Scheme: "ws", Host: *addr, Path: *path}
        log.Printf("connecting to %s", u.String())

        c, _, err := websocket.DefaultDialer.Dial(u.String(), nil)
        if err != nil {
                log.Fatal("dial:", err)
        }
        defer c.Close()

        done := make(chan struct{})

        go func() {
                defer close(done)
                for {
                        _, message, err := c.ReadMessage()
                        if err != nil {
                                log.Println("read:", err)
                                return
                        }
                        log.Printf("recv: %s", message)
                }
        }()

        err = c.WriteMessage(websocket.TextMessage, []byte(time.Now().String()))
        if err != nil {
                log.Println("write:", err)
                return
        }

        ticker := time.NewTicker(time.Second)
        defer ticker.Stop()

        for {
                select {
                case <-done:
                        return
                case t := <-ticker.C:
                        err := c.WriteMessage(websocket.TextMessage, []byte(t.String()))
                        if err != nil {
                                log.Println("write:", err)
                                return
                        }
                case <-interrupt:
                        log.Println("interrupt")

                        // Cleanly close the connection by sending a close message and then
                        // waiting (with timeout) for the server to close the connection.
                        err := c.WriteMessage(websocket.CloseMessage, websocket.FormatCloseMessage(websocket.CloseNormalClosure, ""))
                        if err != nil {
                                log.Println("write close:", err)
                                return
                        }
                        select {
                        case <-done:
                        case <-time.After(time.Second):
                        }
                        return
                }
        }
}
```

</details>

### What did you see happen?

99% of the time (but not always!!) the connection between the reverse proxy and the app is never closed and stays in a FIN_WAIT2 state forever. The reverse proxy and the app send acks forever.

Here are the ports in the below example: 

- 52558: client
- 9999: reverse-proxy as a server
- 47662: reverse proxy as a client
- 8888: backend-app

**annotated tcpdump output for what happens on go 1.25**
```
# I CTRL-C on the client to kill it

# Client sends FIN to reverse proxy
15:36:28.728428 IP 127.0.0.1.52558 > 127.0.0.1.9999: Flags [F.], seq 318, ack 246, win 512, options [nop,nop,TS val 3606194590 ecr 3606194589], length 0

# Reverse proxy sends FIN to app
15:36:28.728470 IP 127.0.0.1.47662 > 127.0.0.1.8888: Flags [F.], seq 369, ack 246, win 512, options [nop,nop,TS val 3606194590 ecr 3606194589], length 0

# Everyone ACKs everyone for a bit
# At this point both connections have state FIN_WAIT2
15:36:28.773847 IP 127.0.0.1.8888 > 127.0.0.1.47662: Flags [.], ack 370, win 512, options [nop,nop,TS val 3606194635 ecr 3606194590], length 0
15:36:28.773850 IP 127.0.0.1.9999 > 127.0.0.1.52558: Flags [.], ack 319, win 512, options [nop,nop,TS val 3606194635 ecr 3606194590], length 0
15:36:43.745859 IP 127.0.0.1.8888 > 127.0.0.1.47662: Flags [.], ack 370, win 512, options [nop,nop,TS val 3606209607 ecr 3606194590], length 0
15:36:43.745893 IP 127.0.0.1.47662 > 127.0.0.1.8888: Flags [.], ack 246, win 512, options [nop,nop,TS val 3606209607 ecr 3606194635], length 0
15:36:43.745859 IP 127.0.0.1.9999 > 127.0.0.1.52558: Flags [.], ack 319, win 512, options [nop,nop,TS val 3606209607 ecr 3606194590], length 0
15:36:43.745923 IP 127.0.0.1.52558 > 127.0.0.1.9999: Flags [.], ack 246, win 512, options [nop,nop,TS val 3606209607 ecr 3606194635], length 0
15:36:58.754527 IP 127.0.0.1.9999 > 127.0.0.1.52558: Flags [.], ack 319, win 512, options [nop,nop,TS val 3606224616 ecr 3606209607], length 0
15:36:58.754527 IP 127.0.0.1.8888 > 127.0.0.1.47662: Flags [.], ack 370, win 512, options [nop,nop,TS val 3606224616 ecr 3606209607], length 0
15:36:58.754570 IP 127.0.0.1.47662 > 127.0.0.1.8888: Flags [.], ack 246, win 512, options [nop,nop,TS val 3606224616 ecr 3606194635], length 0
15:36:58.754584 IP 127.0.0.1.52558 > 127.0.0.1.9999: Flags [.], ack 246, win 512, options [nop,nop,TS val 3606224616 ecr 3606194635], length 0
15:36:58.778199 IP 127.0.0.1.47662 > 127.0.0.1.8888: Flags [.], ack 246, win 512, options [nop,nop,TS val 3606224639 ecr 3606194635], length 0
15:36:58.778277 IP 127.0.0.1.8888 > 127.0.0.1.47662: Flags [.], ack 370, win 512, options [nop,nop,TS val 3606224639 ecr 3606224616], length 0
15:37:13.857800 IP 127.0.0.1.8888 > 127.0.0.1.47662: Flags [.], ack 370, win 512, options [nop,nop,TS val 3606239719 ecr 3606224616], length 0
15:37:13.857836 IP 127.0.0.1.47662 > 127.0.0.1.8888: Flags [.], ack 246, win 512, options [nop,nop,TS val 3606239719 ecr 3606224639], length 0
15:37:13.857800 IP 127.0.0.1.9999 > 127.0.0.1.52558: Flags [.], ack 319, win 512, options [nop,nop,TS val 3606239719 ecr 3606224616], length 0
15:37:13.858056 IP 127.0.0.1.52558 > 127.0.0.1.9999: Flags [.], ack 246, win 512, options [nop,nop,TS val 3606239719 ecr 3606194635], length 0
15:37:28.961631 IP 127.0.0.1.9999 > 127.0.0.1.52558: Flags [.], ack 319, win 512, options [nop,nop,TS val 3606254823 ecr 3606239719], length 0
15:37:28.961631 IP 127.0.0.1.8888 > 127.0.0.1.47662: Flags [.], ack 370, win 512, options [nop,nop,TS val 3606254823 ecr 3606239719], length 0
15:37:28.961649 IP 127.0.0.1.47662 > 127.0.0.1.8888: Flags [.], ack 246, win 512, options [nop,nop,TS val 3606254823 ecr 3606224639], length 0
15:37:28.961635 IP 127.0.0.1.47662 > 127.0.0.1.8888: Flags [.], ack 246, win 512, options [nop,nop,TS val 3606254823 ecr 3606224639], length 0
15:37:28.961656 IP 127.0.0.1.52558 > 127.0.0.1.9999: Flags [.], ack 246, win 512, options [nop,nop,TS val 3606254823 ecr 3606194635], length 0
15:37:28.961658 IP 127.0.0.1.8888 > 127.0.0.1.47662: Flags [.], ack 370, win 512, options [nop,nop,TS val 3606254823 ecr 3606254823], length 0
15:37:44.066569 IP 127.0.0.1.9999 > 127.0.0.1.52558: Flags [.], ack 319, win 512, options [nop,nop,TS val 3606269928 ecr 3606254823], length 0

# Client sends RST to reverse proxy (related to /proc/sys/net/ipv4/tcp_fin_timeout I think) 
# Note that in here in go 1.25 it took >60s for the connection between the client and the reverse proxy to close.
# In go 1.24 it closes nearly instantaneously.
15:37:44.066656 IP 127.0.0.1.52558 > 127.0.0.1.9999: Flags [R], seq 997032030, win 0, length 0

# At this point the connection between the client and reverse proxy is gone.
# At this point the connection between the reverse proxy and the app is still in state FIN_WAIT2

# The Reverse Proxy and app send ACKs forever :(
# In go 1.24 the Reverse Proxy eventually sends a RST packet to the app which closes the connection.
15:37:44.066569 IP 127.0.0.1.8888 > 127.0.0.1.47662: Flags [.], ack 370, win 512, options [nop,nop,TS val 3606269928 ecr 3606254823], length 0
15:37:44.066942 IP 127.0.0.1.47662 > 127.0.0.1.8888: Flags [.], ack 246, win 512, options [nop,nop,TS val 3606269928 ecr 3606254823], length 0
15:37:59.169916 IP 127.0.0.1.8888 > 127.0.0.1.47662: Flags [.], ack 370, win 512, options [nop,nop,TS val 3606285031 ecr 3606269928], length 0
15:37:59.169968 IP 127.0.0.1.47662 > 127.0.0.1.8888: Flags [.], ack 246, win 512, options [nop,nop,TS val 3606285031 ecr 3606254823], length 0
15:37:59.170020 IP 127.0.0.1.47662 > 127.0.0.1.8888: Flags [.], ack 246, win 512, options [nop,nop,TS val 3606285031 ecr 3606254823], length 0
15:37:59.170043 IP 127.0.0.1.8888 > 127.0.0.1.47662: Flags [.], ack 370, win 512, options [nop,nop,TS val 3606285031 ecr 3606285031], length 0
15:38:14.274154 IP 127.0.0.1.8888 > 127.0.0.1.47662: Flags [.], ack 370, win 512, options [nop,nop,TS val 3606300135 ecr 3606285031], length 0
15:38:14.274176 IP 127.0.0.1.47662 > 127.0.0.1.8888: Flags [.], ack 246, win 512, options [nop,nop,TS val 3606300135 ecr 3606285031], length 0

```

**netstat output showing FIN_WAIT2 connection between reverse proxy and app**
```
$ netstat -p | grep FIN
tcp        0      0 localhost:47662         localhost:8888          FIN_WAIT2   1116293/rprox
```

If I only run the client and kill it once, then the connection will hang open forever (99% of the time).  If I continually run the client and kill it, then the open connections will accumulate, but only to a point. Once it reaches ~100-200 connections they all get cleaned up. I assume this is related to some settings on my reverse proxy or app or machine, but I don't know which.

### What did you expect to see?

I expected all connections to close.

Here are the ports in the below example: 

- 59942: client
- 9999: reverse-proxy as a server
- 38512: reverse proxy as a client
- 8888: backend-app

**annotated tcpdump output for what happens on go 1.24.7**
```
# I CTRL-C on the client to kill it

# Client sends FIN to reverse proxy
20:22:51.780826 IP 127.0.0.1.59942 > 127.0.0.1.9999: Flags [F.], seq 318, ack 246, win 512, options [nop,nop,TS val 3619481205 ecr 3619481204], length 0

# Reverse Proxy sends FIN back to the client (this does not happen in go 1.25)
20:22:51.781430 IP 127.0.0.1.9999 > 127.0.0.1.59942: Flags [F.], seq 246, ack 319, win 512, options [nop,nop,TS val 3619481205 ecr 3619481205], length 0
20:22:51.781442 IP 127.0.0.1.59942 > 127.0.0.1.9999: Flags [.], ack 247, win 512, options [nop,nop,TS val 3619481205 ecr 3619481205], length 0

# At this point the connection between the client and the reverse proxy is closed.
# Here in go 1.24 this happens almost immediately (about 0.001 seconds).
# In go 1.25 it takes ~60s for some setting to timeout for the client <-> reverse proxy connection to close.

# Reverse Proxy sends Fin to the app
20:22:51.781582 IP 127.0.0.1.38512 > 127.0.0.1.8888: Flags [F.], seq 369, ack 246, win 512, options [nop,nop,TS val 3619481205 ecr 3619481204], length 0

# Reverse Proxy and app ACK back and forth for a bit
20:22:51.822773 IP 127.0.0.1.8888 > 127.0.0.1.38512: Flags [.], ack 370, win 512, options [nop,nop,TS val 3619481247 ecr 3619481205], length 0
20:23:06.807097 IP 127.0.0.1.8888 > 127.0.0.1.38512: Flags [.], ack 370, win 512, options [nop,nop,TS val 3619496231 ecr 3619481205], length 0
20:23:06.807137 IP 127.0.0.1.38512 > 127.0.0.1.8888: Flags [.], ack 246, win 512, options [nop,nop,TS val 3619496231 ecr 3619481247], length 0
20:23:21.847140 IP 127.0.0.1.8888 > 127.0.0.1.38512: Flags [.], ack 370, win 512, options [nop,nop,TS val 3619511271 ecr 3619496231], length 0
20:23:21.847192 IP 127.0.0.1.38512 > 127.0.0.1.8888: Flags [.], ack 246, win 512, options [nop,nop,TS val 3619511271 ecr 3619481247], length 0
20:23:36.951288 IP 127.0.0.1.8888 > 127.0.0.1.38512: Flags [.], ack 370, win 512, options [nop,nop,TS val 3619526375 ecr 3619511271], length 0
20:23:36.951345 IP 127.0.0.1.38512 > 127.0.0.1.8888: Flags [.], ack 246, win 512, options [nop,nop,TS val 3619526375 ecr 3619481247], length 0
20:23:52.059354 IP 127.0.0.1.8888 > 127.0.0.1.38512: Flags [.], ack 370, win 512, options [nop,nop,TS val 3619541483 ecr 3619526375], length 0
20:23:52.059409 IP 127.0.0.1.38512 > 127.0.0.1.8888: Flags [.], ack 246, win 512, options [nop,nop,TS val 3619541483 ecr 3619481247], length 0
20:24:07.159309 IP 127.0.0.1.8888 > 127.0.0.1.38512: Flags [.], ack 370, win 512, options [nop,nop,TS val 3619556583 ecr 3619541483], length 0

# Reverse Proxy sends a RST packet to the app and the connection is closed (this does not happen in go 1.25)
20:24:07.159346 IP 127.0.0.1.38512 > 127.0.0.1.8888: Flags [R], seq 2350419052, win 0, length 0
```

**Comment by prattmic** [comment]
cc @neild

**Comment by odeke-em** [comment]
@ameowlia thank you very much for the report! I have condensed the repro into 1 file and made it made it into a test that you can then tweak for direct reproduction and when fixed please add it as a regression test

```go
package repro

import (
	"net/http"
	"net/http/httptest"
	"net/http/httputil"
	"net/url"
	"os"
	"os/signal"
	"strings"
	"testing"
	"time"

	"github.com/gorilla/websocket"
	"golang.org/x/net/http/httpguts"
)

var upgrader = websocket.Upgrader{
	ReadBufferSize:  1024,
	WriteBufferSize: 1024,
}

func upgradeType(h http.Header) string {
	if !httpguts.HeaderValuesContainsToken(h["Connection"], "Upgrade") {
		return ""
	}
	return strings.ToLower(h.Get("Upgrade"))
}

// Reproduction for https://golang.org/issues/75807.
func TestReproWebsocketNotBeingClosedCorrectly(t *testing.T) {
	// 1. Setup the backend server.
	cst := httptest.NewServer(http.HandlerFunc(func(rw http.ResponseWriter, req *http.Request) {
		if upgradeType(req.Header) != "websocket" {
			http.Error(rw, "Unexpected request", 400)
			return
		}

		conn, err := upgrader.Upgrade(rw, req, nil)
		if err != nil {
			t.Error(err)
			return
		}

		for {
			// Read message.
			msgType, msg, err := conn.ReadMessage()
			if err != nil {
				t.Errorf("Read message: %v", err)
				return
			}

			// Write same message back.
			if err = conn.WriteMessage(msgType, msg); err != nil {
				t.Errorf("Write message: %v", err)
				return
			}
		}
	}))
	defer cst.Close()

	backendServerURL, err := url.Parse(cst.URL)
	if err != nil {
		t.Fatal(err)
	}

	// 2. Setup the proxy.
	proxyURL, proxyDone := setupProxy(t, backendServerURL)
	defer proxyDone()

	// 3. Find the PID of the current process that we shall then send an interrupt to.
	pid := os.Getpid()
	process, err := os.FindProcess(pid)
	if err != nil {
		t.Fatal(err)
	}

	websocketStartedCh := make(chan bool)

	go func() {
		<-websocketStartedCh
		<-time.After(1 * time.Second)
		process.Signal(os.Interrupt)
	}()

	// 4. Run the Websocket request.
	runWebSocketRequest(t, proxyURL.Host, websocketStartedCh)
}

func setupProxy(t *testing.T, remote *url.URL) (*url.URL, func()) {
	handler := func(p *httputil.ReverseProxy) func(http.ResponseWriter, *http.Request) {
		return func(w http.ResponseWriter, r *http.Request) {
			p.ServeHTTP(w, r)
		}
	}

	proxy := httputil.NewSingleHostReverseProxy(remote)
	mux := http.NewServeMux()
	mux.HandleFunc("/", handler(proxy))

	cst := httptest.NewServer(mux)
	closeFn := func() {
		cst.Close()
	}

	proxyURL, err := url.Parse(cst.URL)
	if err != nil {
		t.Fatal(err)
	}
	return proxyURL, closeFn
}

func runWebSocketRequest(t *testing.T, addr string, signalStartCh chan bool) {
	u := url.URL{Scheme: "ws", Host: addr, Path: "/echo"}
	t.Logf("Connecting to %s", u.String())

	c, _, err := websocket.DefaultDialer.Dial(u.String(), nil)
	if err != nil {
		t.Fatalf("Dial: %v", err)
	}
	defer c.Close()

	done := make(chan struct{})

	go func() {
		// Run the Websocket receiving routine.
		defer close(done)

		for {
			_, message, err := c.ReadMessage()
			if err != nil {
				t.Errorf("read: %v", err)
				return
			}
			t.Logf("recv: %s", message)
		}
	}()

	if err = c.WriteMessage(websocket.TextMessage, []byte("Right now")); err != nil {
		t.Fatalf("write: %v", err)
	}
	close(signalStartCh)

	ticker := time.NewTicker(70 * time.Millisecond)
	defer ticker.Stop()

	interrupt := make(chan os.Signal, 1)
	signal.Notify(interrupt, os.Interrupt)

	for {
		select {
		case <-done:
			return

		case tt := <-ticker.C:
			err := c.WriteMessage(websocket.TextMessage, []byte(tt.String()))
			if err != nil {
				t.Fatalf("write: %v", err)
			}

		case <-interrupt:
			t.Log("Interrupt")

			// Cleanly close the connection by sending a close message and then
			// waiting (with timeout) for the server to close the connection.
			err := c.WriteMessage(websocket.CloseMessage, websocket.FormatCloseMessage(websocket.CloseNormalClosure, ""))
			if err != nil {
				t.Errorf("write close: %v", err)
				return
			}

			select {
			case <-done:
			case <-time.After(time.Second):
			}
			return
		}
	}
}
```

and just when run with `go test` will produce

```shell
$ go test
--- FAIL: TestReproWebsocketNotBeingClosedCorrectly (1.00s)
    it_test.go:115: Connecting to ws://127.0.0.1:53171/echo
    it_test.go:135: recv: Right now
    it_test.go:135: recv: 2025-10-09 02:21:08.235181968 +0300 EAT m=+0.072321905
    it_test.go:135: recv: 2025-10-09 02:21:08.305184735 +0300 EAT m=+0.142324232
    it_test.go:135: recv: 2025-10-09 02:21:08.375183955 +0300 EAT m=+0.212323523
    it_test.go:135: recv: 2025-10-09 02:21:08.445183106 +0300 EAT m=+0.282322210
    it_test.go:135: recv: 2025-10-09 02:21:08.515184995 +0300 EAT m=+0.352324000
    it_test.go:135: recv: 2025-10-09 02:21:08.585182374 +0300 EAT m=+0.422321382
    it_test.go:135: recv: 2025-10-09 02:21:08.655183628 +0300 EAT m=+0.492322759
    it_test.go:135: recv: 2025-10-09 02:21:08.725184354 +0300 EAT m=+0.562323037
    it_test.go:135: recv: 2025-10-09 02:21:08.795183812 +0300 EAT m=+0.632321896
    it_test.go:135: recv: 2025-10-09 02:21:08.865183632 +0300 EAT m=+0.702321634
    it_test.go:135: recv: 2025-10-09 02:21:08.935183484 +0300 EAT m=+0.772321590
    it_test.go:135: recv: 2025-10-09 02:21:09.005183181 +0300 EAT m=+0.842321311
    it_test.go:135: recv: 2025-10-09 02:21:09.075186823 +0300 EAT m=+0.912324503
    it_test.go:135: recv: 2025-10-09 02:21:09.145187169 +0300 EAT m=+0.982324057
    it_test.go:162: Interrupt
    it_test.go:49: Read message: websocket: close 1000 (normal)
    it_test.go:132: read: websocket: close 1000 (normal)
FAIL
exit status 1
FAIL	github.com/orijtech/bugs/golang	2.501s
```

**Comment by ameowlia** [comment]
Hi @odeke-em , Thank you for looking into this so quickly.

However, when I run your regression test it fails when using go 1.24.7. When I run my reproduction code, I do not get an error with go 1.24.7. This makes me think it is not testing the same issue.

**Comment by neild** [comment]
Thanks for the very nice reproduction case.

Your server is never closing the connection. The client exits, the proxy half-closes the connection to the server, the server reads an error from `conn.ReadMessage`, the server handler exits, and the connection is left open.

On the server side, you can fix this by adding a `defer conn.Close()` after the `upgrader.Upgrade`.

The server is misbehaving in this case, but I think `ReverseProxy` should be doing a better job of handling this misbehavior. Prior to [CL 637939](https://go.dev/cl/637939), it would completely close a connection if either side half-closed the connection. After that CL, it passes through half-closes. In a case like this one, where the backend never closes its end of the half-closed connection, the connection is left open indefinitely.

I think we should probably have a timeout for the half-closed state.

Looking at all this, I think we should also have some form of idleness detection for hijacked connections. That might need to be configurable and off-by-default to avoid breaking any existing users, however.

**Comment by neild** [comment]
Filed a separate issue for idle timeouts for upgraded connections: #75830

**Comment by ameowlia** [comment]
Thank you for your quick and thorough response @neild. Shall I leave this issue open to represent your suggestion for a timeout for the half-closed state?

**Comment by neild** [comment]
Sure, let's keep this open for now.

My initial thought was that we could just set a reasonable default timeout for half-closed connections. However, I think that will break users depending on half-close support. At least one of the scenarios described in #35892 (https://github.com/rancher-sandbox/rancher-desktop/issues/3239) seems to involve a client write-closing a connection and then reading an unboundedly large stream from the connection. I think any timeout we set on that response is going to be wrong.

Perhaps there's something automatic we can do (so we can keep this issue for now), but it's possible we just need general-purpose idle timeouts (#75830).

**Comment by neild** [comment]
I'm going to close this in favor of #75830, since I can't think of anything automatic we can do that doesn't break existing users.
