### ISSUE TITLE
http.Transport.RoundTrip returns EOF for empty response

### ISSUE THREAD

**Issue by alexflint** [golang/go#13667]
```
go version go1.5 linux/amd64
```
```
Ubuntu 14.04.3 LTS
```

I made an HTTP request to a server that accepts all TCP connections and then immediately closes them. I was expecting a meaningful error such as "connection closed before request could be sent" but http.RoundTrip returned EOF.

Here are client and server snippets that reproduce this. The client:
```
package main

import (
	"fmt"
	"net"
	"net/http"
)

func main() {
	dialer := &net.Dialer{}
	transport := &http.Transport{
		Dial: dialer.Dial,
	}

	request, _ := http.NewRequest("GET", "http://127.0.0.1:19870/", nil)
	_, err := transport.RoundTrip(request)
	fmt.Println(err)
}
```
Output is:
```
EOF
```
And the server:
```go
package main

import "net"

func main() {
	ln, _ := net.Listen("tcp", ":19870")
	conn, _ := ln.Accept()
	conn.Close()
}
```

Here is a dump of the TCP exchange:
```
17:16:31.017342 IP localhost.52287 > localhost.19870: Flags [S], seq 3991906392, win 43690, options [mss 65495,sackOK,TS val 27880590 ecr 0,nop,wscale 7], length 0
E..<..@.@.w..........?M....X.........0.........
..l.........
17:16:31.017356 IP localhost.19870 > localhost.52287: Flags [S.], seq 530413255, ack 3991906393, win 43690, options [mss 65495,sackOK,TS val 27880590 ecr 27880590,nop,wscale 7], length 0
E..<..@.@.<.........M..?..v....Y.....0.........
..l...l.....
17:16:31.017367 IP localhost.52287 > localhost.19870: Flags [.], ack 1, win 342, options [nop,nop,TS val 27880590 ecr 27880590], length 0
E..4..@.@.w..........?M....Y..v....V.(.....
..l...l.
17:16:31.017514 IP localhost.19870 > localhost.52287: Flags [F.], seq 1, ack 1, win 342, options [nop,nop,TS val 27880591 ecr 27880590], length 0
E..4.F@.@."|........M..?..v....Y...V.(.....
..l...l.
17:16:31.019472 IP localhost.52287 > localhost.19870: Flags [F.], seq 1, ack 2, win 342, options [nop,nop,TS val 27880591 ecr 27880591], length 0
E..4..@.@.w..........?M....Y..v....V.(.....
..l...l.
17:16:31.019493 IP localhost.19870 > localhost.52287: Flags [.], ack 2, win 342, options [nop,nop,TS val 27880591 ecr 27880591], length 0
E..4.G@.@."{........M..?..v....Z...V.(.....
..l...l.
```

**Comment by bradfitz** [comment]
True, but I think it's basically always been like this.

And how often does this happen?

I'm not against fixing this and making the errors more descriptive, but it's pretty low priority. I'd be happy to review code if others want to work on it.

**Comment by alexflint** [comment]
The reason this came up was that if you start a docker container with an exposed port but the process inside the container is not listening on the internal port, then the (admittedly braindead) docker daemon will SYNACK all incoming connections and then immediately FIN them. This seems like a generic-enough situation given the popularity of docker to care about this case.

I'm up for putting in a cl to fix this.

**Comment by odeke-em** [comment]
So interestingly, am able to get a meaningful response as requested in the issue but not consistently, please gist https://gist.github.com/odeke-em/dc45c763d311210fbdd1 -- this is without modifying the logic in net/http except for just mere log.Println's
and snippets
<img width="889" alt="screen shot 2015-12-17 at 6 59 34 pm" src="https://cloud.githubusercontent.com/assets/4898263/11887334/5d588462-a4f0-11e5-9354-ee438be7747a.png">

**Comment by alexflint** [comment]
Yes I have also seen the "transport closed before response was received" error on occasion. Could there be a race condition here?

**Comment by bradfitz** [comment]
I don't think there is a data race. There is definitely a higher-level race of many things happening network-wise, though. Read net/http/transport.go's persistConn.roundTrip code.

**Comment by bradfitz** [comment]
I think this was already fixed by https://golang.org/cl/23160

But it could use a new test to confirm.

**Comment by bradfitz** [comment]
Actually, this is somewhat intentional. See ea2376fcea0be75c856ebd199c0ad0f98192d406 which came out of #16465.

But we should probably have different behavior on the first request on a connection at least.

Much has changed in the past two releases, so it's probably time to revisit this. But too much changes this cycle too (Request.GetBody in Go 1.8) so I'll punt this to Go 1.9.

(Incidentally, while thinking about this I realized Go 1.8 adding Request.GetBody meant we could've done more in terms of retries in the Transport. I just filed #17844 for Go 1.9)

**Comment by hktalent** [comment]
me too
```
net/http.(*persistConn).roundTrip(0xc00b0c0b40, 0xc009e14a00)
	/usr/local/Cellar/go/1.18.3/libexec/src/net/http/transport.go:2620 +0x974
net/http.(*Transport).roundTrip(0xc00b620dc0, 0xc01739f600)
	/usr/local/Cellar/go/1.18.3/libexec/src/net/http/transport.go:594 +0x7c9
net/http.(*Transport).RoundTrip(0xc01739f600?, 0x6e94d40?)
	/usr/local/Cellar/go/1.18.3/libexec/src/net/http/roundtrip.go:17 +0x19
net/http.send(0xc01739f500, {0x6e94d40, 0xc00b620dc0}, {0x59a3880?, 0x408e301?, 0x826f2c0?})
	/usr/local/Cellar/go/1.18.3/libexec/src/net/http/client.go:252 +0x5d8
net/http.(*Client).send(0xc00bbec0c0, 0xc01739f500, {0x203002?, 0xc00bbec120?, 0x826f2c0?})
	/usr/local/Cellar/go/1.18.3/libexec/src/net/http/client.go:176 +0x9b
net/http.(*Client).do(0xc00bbec0c0, 0xc01739f500)
	/usr/local/Cellar/go/1.18.3/libexec/src/net/http/client.go:725 +0x8f5
net/http.(*Client).Do(...)
	/usr/local/Cellar/go/1.18.3/libexec/src/net/http/client.go:593
```
