### ISSUE TITLE
What is the difference between go processing unix socket and tcp socket?

### ISSUE THREAD

**Issue by helios741** [golang/go#44371]
### What version of Go are you using (`go version`)?

<pre>
# go version
go version go1.13.9 linux/amd64

</pre>

### Does this issue reproduce with the latest release?

yes

### What operating system and processor architecture are you using (`go env`)?

<details><summary><code>go env</code> Output</summary><br><pre>
$ go env
go version go1.13.9 linux/amd64
root@iZ8vbaym9jmge8qd5hlcpiZ:~# go env
GO111MODULE=""
GOARCH="amd64"
GOBIN=""
GOCACHE="/root/.cache/go-build"
GOENV="/root/.config/go/env"
GOEXE=""
GOFLAGS=""
GOHOSTARCH="amd64"
GOHOSTOS="linux"
GONOPROXY=""
GONOSUMDB=""
GOOS="linux"
GOPATH="/root/go"
GOPRIVATE=""
GOPROXY="https://proxy.golang.org,direct"
GOROOT="/usr/local/go-1.13"
GOSUMDB="sum.golang.org"
GOTMPDIR=""
GOTOOLDIR="/usr/local/go-1.13/pkg/tool/linux_amd64"
GCCGO="gccgo"
AR="ar"
CC="gcc"
CXX="g++"
CGO_ENABLED="1"
GOMOD=""
CGO_CFLAGS="-g -O2"
CGO_CPPFLAGS=""
CGO_CXXFLAGS="-g -O2"
CGO_FFLAGS="-g -O2"
CGO_LDFLAGS="-g -O2"
PKG_CONFIG="pkg-config"
GOGCCFLAGS="-fPIC -m64 -pthread -fmessage-length=0 -fdebug-prefix-map=/tmp/go-build047706954=/tmp/go-build -gno-record-gcc-switches"
</pre></details>

### What did you do?

I have a simple go program, deployed on the cloud:

```golang
package main

import (
  "fmt"
  "log"
  "net/http"
  "os"
  "os/signal"
  "syscall"
  "time"
  _ "net/http/pprof"
)

func main() {

  h2 := func(w http.ResponseWriter, _ *http.Request) {
    time.Sleep(2 * time.Second)
    fmt.Println("555555")
    if _, err := w.Write(make([]byte, 3961)); err != nil {
      fmt.Println("---=====: ", err.Error(), syscall.EPIPE == err)
      return
    }
  }
  go func() {
    log.Println(http.ListenAndServe(":6060", nil))
  }()
  http.HandleFunc("/endpoint", h2)
  sigs := make(chan os.Signal, 1)
  signal.Notify(sigs, syscall.SIGPIPE)
  go func() {
    sig := <-sigs
    fmt.Println("6666666666", sig.String())
    fmt.Println(sig)
  }()
  log.Fatal(http.ListenAndServe(":8888", nil))
}
```

curl 47.92.3.20:8888/endpoint -m 0.2
output: 555555
<details><summary><code>tcpdump  port 8888 -vv -nn</code> Output</summary><br><pre>
19:24:06.751942 IP (tos 0x14, ttl 50, id 0, offset 0, flags [none], proto TCP (6), length 64)
    111.202.28.1.54770 > 172.28.130.126.8888: Flags [S], cksum 0x2480 (correct), seq 2810293911, win 65535, options [mss 1386,nop,wscale 6,nop,nop,TS val 600106455 ecr 0,sackOK,eol], length 0
19:24:06.752019 IP (tos 0x0, ttl 64, id 0, offset 0, flags [DF], proto TCP (6), length 60)
    172.28.130.126.8888 > 111.202.28.1.54770: Flags [S.], cksum 0xba94 (incorrect -> 0x7d03), seq 3741540058, ack 2810293912, win 65160, options [mss 1460,sackOK,TS val 4288183333 ecr 600106455,nop,wscale 7], length 0
19:24:06.781810 IP (tos 0x14, ttl 50, id 0, offset 0, flags [none], proto TCP (6), length 52)
    111.202.28.1.54770 > 172.28.130.126.8888: Flags [.], cksum 0xa230 (correct), seq 1, ack 1, win 2061, options [nop,nop,TS val 600106482 ecr 4288183333], length 0
19:24:06.781856 IP (tos 0x14, ttl 50, id 0, offset 0, flags [none], proto TCP (6), length 139)
    111.202.28.1.54770 > 172.28.130.126.8888: Flags [P.], cksum 0x0bd3 (correct), seq 1:88, ack 1, win 2061, options [nop,nop,TS val 600106482 ecr 4288183333], length 87
19:24:06.781876 IP (tos 0x0, ttl 64, id 28904, offset 0, flags [DF], proto TCP (6), length 52)
    172.28.130.126.8888 > 111.202.28.1.54770: Flags [.], cksum 0xba8c (incorrect -> 0xa7cc), seq 1, ack 88, win 509, options [nop,nop,TS val 4288183362 ecr 600106482], length 0
19:24:06.958124 IP (tos 0x14, ttl 50, id 0, offset 0, flags [none], proto TCP (6), length 52)
    111.202.28.1.54770 > 172.28.130.126.8888: Flags [F.], cksum 0xa110 (correct), seq 88, ack 1, win 2061, options [nop,nop,TS val 600106653 ecr 4288183362], length 0
19:24:06.999004 IP (tos 0x0, ttl 64, id 28905, offset 0, flags [DF], proto TCP (6), length 52)
    172.28.130.126.8888 > 111.202.28.1.54770: Flags [.], cksum 0xba8c (incorrect -> 0xa647), seq 1, ack 89, win 509, options [nop,nop,TS val 4288183579 ecr 600106653], length 0
19:24:08.783096 IP (tos 0x0, ttl 64, id 28906, offset 0, flags [DF], proto TCP (6), length 2800)
    172.28.130.126.8888 > 111.202.28.1.54770: Flags [.], cksum 0xc548 (incorrect -> 0xa086), seq 1:2749, ack 89, win 509, options [nop,nop,TS val 4288185363 ecr 600106653], length 2748
19:24:08.783113 IP (tos 0x0, ttl 64, id 28908, offset 0, flags [DF], proto TCP (6), length 1400)
    172.28.130.126.8888 > 111.202.28.1.54770: Flags [P.], cksum 0xbfd0 (incorrect -> 0x4823), seq 2749:4097, ack 89, win 509, options [nop,nop,TS val 4288185363 ecr 600106653], length 1348
19:24:08.783122 IP (tos 0x0, ttl 64, id 28909, offset 0, flags [DF], proto TCP (6), length 53)
    172.28.130.126.8888 > 111.202.28.1.54770: Flags [P.], cksum 0xba8d (incorrect -> 0x8545), seq 4097:4098, ack 89, win 509, options [nop,nop,TS val 4288185364 ecr 600106653], length 1
19:24:08.832804 IP (tos 0x14, ttl 50, id 27084, offset 0, flags [none], proto TCP (6), length 40)
    111.202.28.1.54770 > 172.28.130.126.8888: Flags [R], cksum 0xa65d (correct), seq 2810294000, win 0, length 0
19:24:08.832835 IP (tos 0x14, ttl 50, id 34645, offset 0, flags [none], proto TCP (6), length 40)
    111.202.28.1.54770 > 172.28.130.126.8888: Flags [R], cksum 0xa65d (correct), seq 2810294000, win 0, length 0
19:24:08.832844 IP (tos 0x14, ttl 50, id 65046, offset 0, flags [none], proto TCP (6), length 40)
    111.202.28.1.54770 > 172.28.130.126.8888: Flags [R], cksum 0xa65d (correct), seq 2810294000, win 0, length 0
19:24:08.832847 IP (tos 0x14, ttl 50, id 56372, offset 0, flags [none], proto TCP (6), length 40)
    111.202.28.1.54770 > 172.28.130.126.8888: Flags [R], cksum 0xa65d (correct), seq 2810294000, win 0, length 0
</pre></details>

curl 127.0.0.1:8888/endpoint -m 0.2
output:
```shell
555555
6666666666 broken pipe
broken pipe
```
<details><summary><code> tcpdump -i lo port 8888 -vv -nn</code> Output</summary><br><pre>
19:25:02.094405 IP (tos 0x0, ttl 64, id 25493, offset 0, flags [DF], proto TCP (6), length 60)
    127.0.0.1.59234 > 127.0.0.1.8888: Flags [S], cksum 0xfe30 (incorrect -> 0x16e8), seq 2032212320, win 65495, options [mss 65495,sackOK,TS val 2689924136 ecr 0,nop,wscale 7], length 0
19:25:02.094423 IP (tos 0x0, ttl 64, id 0, offset 0, flags [DF], proto TCP (6), length 60)
    127.0.0.1.8888 > 127.0.0.1.59234: Flags [S.], cksum 0xfe30 (incorrect -> 0x9785), seq 3533639744, ack 2032212321, win 65483, options [mss 65495,sackOK,TS val 2689924136 ecr 2689924136,nop,wscale 7], length 0
19:25:02.094437 IP (tos 0x0, ttl 64, id 25494, offset 0, flags [DF], proto TCP (6), length 52)
    127.0.0.1.59234 > 127.0.0.1.8888: Flags [.], cksum 0xfe28 (incorrect -> 0xbe41), seq 1, ack 1, win 512, options [nop,nop,TS val 2689924136 ecr 2689924136], length 0
19:25:02.095058 IP (tos 0x0, ttl 64, id 25495, offset 0, flags [DF], proto TCP (6), length 138)
    127.0.0.1.59234 > 127.0.0.1.8888: Flags [P.], cksum 0xfe7e (incorrect -> 0x7dcc), seq 1:87, ack 1, win 512, options [nop,nop,TS val 2689924137 ecr 2689924136], length 86
19:25:02.095068 IP (tos 0x0, ttl 64, id 63900, offset 0, flags [DF], proto TCP (6), length 52)
    127.0.0.1.8888 > 127.0.0.1.59234: Flags [.], cksum 0xfe28 (incorrect -> 0xbdea), seq 1, ack 87, win 511, options [nop,nop,TS val 2689924137 ecr 2689924137], length 0
19:25:02.295044 IP (tos 0x0, ttl 64, id 25496, offset 0, flags [DF], proto TCP (6), length 52)
    127.0.0.1.59234 > 127.0.0.1.8888: Flags [F.], cksum 0xfe28 (incorrect -> 0xbd20), seq 87, ack 1, win 512, options [nop,nop,TS val 2689924337 ecr 2689924137], length 0
19:25:02.339002 IP (tos 0x0, ttl 64, id 63901, offset 0, flags [DF], proto TCP (6), length 52)
    127.0.0.1.8888 > 127.0.0.1.59234: Flags [.], cksum 0xfe28 (incorrect -> 0xbc2c), seq 1, ack 88, win 512, options [nop,nop,TS val 2689924381 ecr 2689924337], length 0
19:25:04.097247 IP (tos 0x0, ttl 64, id 63902, offset 0, flags [DF], proto TCP (6), length 4148)
    127.0.0.1.8888 > 127.0.0.1.59234: Flags [P.], cksum 0x0e29 (incorrect -> 0x6919), seq 1:4097, ack 88, win 512, options [nop,nop,TS val 2689926139 ecr 2689924337], length 4096
19:25:04.097278 IP (tos 0x0, ttl 64, id 0, offset 0, flags [DF], proto TCP (6), length 40)
    127.0.0.1.59234 > 127.0.0.1.8888: Flags [R], cksum 0x14ea (correct), seq 2032212408, win 0, length 0
</pre></details>

### What did you expect to see?

I know that the size of http buffer is 4k, but why is the content of tcp socket and unix socket different?

**Comment by seankhliao** [comment]
Unlike many projects, the Go project does not use GitHub Issues for general discussion or asking questions. GitHub Issues are used for tracking bugs and proposals only.

For questions please refer to https://github.com/golang/go/wiki/Questions
